{
  "id": "sparse-tensor-cores",
  "type": "paper",
  "name": "Accelerating Sparse Deep Neural Networks",
  "status": "verified",
  "confidence": 0.88,
  "updated": "2026-10-03",
  "sources": [
    "pap-quant-sparse-tensor-cores"
  ],
  "arxiv_id": "2104.08378",
  "venue": "arxiv-preprint",
  "year": 2021,
  "category": "sparsity",
  "authors": [
    "Corbett, et al. (NVIDIA)"
  ],
  "affiliations": [
    "NVIDIA"
  ],
  "problem": "Sparsity research mostly targets high sparsity levels that no shipping matrix-math unit supports, so it produces compression without speedup.",
  "mechanism": "Documents and designs the NVIDIA Ampere Sparse Tensor Core: a 2:4 semi-structured sparsity pattern (exactly 2 zeros in every group of 4 consecutive weights along the K dimension) so the hardware can drop half of every MAC while keeping a dense, regular memory layout - the metadata and pruning overhead is paid at training time instead of at inference time. Ships a training workflow (magnitude pruning plus fine-tuning to recover the accuracy lost to the constraint) that produces networks that satisfy the 2:4 requirement while matching unpruned accuracy.",
  "hardware_relevance": [
    "nvidia-a100-80gb-sxm4",
    "nvidia-a100-80gb-pcie",
    "nvidia-a30",
    "nvidia-rtx-3090",
    "nvidia-rtx-4090"
  ],
  "speedup_reported": "Paper's own claim (abstract): the 2:4 (50%) sparsity pattern 'leads to TWICE THE MATH THROUGHPUT of dense matrix units' on Sparse Tensor Cores. That is a hardware claim, not a model claim, and it is the number that made 2:4 the default structured-sparsity pattern. COMPRESSION RATIO: 2x (50% of weights stored, zero-valued). QUALITY COST: the training workflow maintains accuracy on 'a wide range of common tasks and model architectures' - pruning to 2:4 is not free, the cost is paid in fine-tuning, which is why this became the pattern of choice for inference-side sparsity.",
  "adoption": "in-production",
  "code_url": null,
  "open_weights": null,
  "notes": "arXiv ID 2104.08378 verified by Semantic Scholar /paper/search/match (title exact) and cross-checked against the repo's flop-flashattention-era sources; NOTE the v1 date (2021-04-19) is NOT independently verified against the /abs/ page because arXiv was rate-limiting during this pass - flagged rather than guessed. Venue: Semantic Scholar returns arXiv.org only - arxiv-preprint. adoption=in-production is justified structurally: 2:4 is a HARDWARE constraint of Ampere-and-later Tensor Cores, so every deployment that uses it is running this design. arXiv ID and title verified by fetching https://arxiv.org/abs/2104.08378 and reading the citation_title meta tag on 2026-10-03. Venue and year from the Semantic Scholar graph API batch endpoint (paper/arXiv:2104.08378) unless the record's notes say otherwise."
}
