{
 "id": "hubert",
 "type": "paper",
 "name": "HuBERT: Self-Supervised Speech Representation Learning by Masked Prediction of Hidden Units",
 "arxiv_id": "2106.07447",
 "venue": "other",
 "year": 2021,
 "category": "speech",
 "authors": [
  "Wei-Ning Hsu",
  "Benjamin Bolte",
  "Yao-Hung Hubert Tsai",
  "Kushal Lakhotia",
  "Ruslan Salakhutdinov",
  "Abdelrahman Mohamed"
 ],
 "affiliations": [
  "Facebook AI Research"
 ],
 "problem": "Speech has no lexicon and no fixed segmentation, so masked prediction needs a target definition before the loss can be written.",
 "mechanism": "Two-stage: pretrain a wav2vec 2.0-style model, then cluster its latent features with k-means offline (100 clusters, two refinement iterations), then train a BERT-style masked prediction of the cluster IDs over masked spans only. The prediction loss on masked regions forces a combined acoustic and language model.",
 "hardware_relevance": [],
 "speedup_reported": "Matches or beats wav2vec 2.0 on Librispeech (960h) and Libri-light (60,000h) at 10min/1h/10h/100h/960h fine-tune budgets, with the 1B-parameter model improving further. A WER comparison only; the paper states no latency, FLOP or hardware figures, so this record carries no speedup claim.",
 "adoption": "in-upstream-engine",
 "code_url": "https://github.com/facebookresearch/fairseq",
 "open_weights": true,
 "notes": "Venue is IEEE/ACM TASLP vol. 38 issue 1 (Jan 2021) pp. 42-52, confirmed via crossref; the schema's venue enum has no TASLP entry, so 'other' is the honest encoding rather than 'icassp'. HuBERT encoders are shipped in several production ASR stacks as a frozen feature extractor, which is where the inference benefit lands: the encoder runs once per utterance and its output is cached across a beam search.\n\nVENUE_TRACK BACKFILL 2026-10-04 (paper-fields pass, agent w3p): venue_track 'main'. Peer-reviewed venue confirmed as IEEE/ACM TASLP 2021 (same). This is an additive track annotation; `venue` is unchanged at 'other' and no status change is implied by the track alone.",
 "status": "verified",
 "confidence": 0.85,
 "updated": "2026-10-04",
 "sources": [
  "pap-mm-hubert"
 ],
 "venue_track": "main"
}